item,itemLabel,position,positionLabel,start,psid
Q106580823,Alousséni Sanou,Q98914328,Finance minister of Mali,2020-10-05,Q106580823-4397768f-46b8-4bac-2ba9-9ca8f80d7d30
Q113577661,Abdoulaye Maïga,Q30100640,Prime Minister of Mali,2022-08-21,Q113577661-380c9638-4cc0-dde0-64de-a7d7eb1d501c
Q2821367,Abdoulaye Diop,Q2101065,Minister of Foreign Affairs,2021-06-11,Q2821367-FA15CAA9-0539-4678-9CC2-762C0173DD57
Q30121857,Salif Traoré,Q64029451,minister of the Internal Security and of the Civil Protection,2015-09-25,Q30121857-f7718fd2-4850-7aa5-b302-60a82640a725
Q3310864,Michel Sidibé,Q98915776,Health minister of Mali,2019-05-06,Q3310864-e253f128-43ca-bb83-e3f0-0ac7dbe3e587
